<?xml version="1.0"?>
<dataDocument xmlns:xsi="http://www.w3.org/2001/XMLSchema-instance" xsi:schemaLocation="example-12.xsd example-12.xsd">
    <a>
        <b>
            <c>FISH</c>
            <d>CHIPS</d>
        </b>
        <b>
            <c>SAUSAGE</c>
            <d>GRAVY</d>
        </b>
        <b>
            <c>STEAK</c>
            <d>POTATOS</d>
        </b>
    </a>
</dataDocument>